{
  "protocolId": "ascii-art-powershell-cli-v1",
  "blindId": "B0041",
  "judgeBlock": 5,
  "scheduleId": "P07-R3-control",
  "runId": "P07-R3-control-A1",
  "sourceArtifactBundleSha256": "6df591722e70277917dc445e705853d2b3a8d1a882b5cbbee1e6b508799fe249",
  "blindBundlePath": "blind/B0041.bundle.json",
  "blindBundleSha256": "10b1565a04383b717e599a45d74ab4c8fbea1824b9c86be108b48a70057ab019"
}
