{
  "protocolId": "ascii-art-powershell-cli-v1",
  "blindId": "B0003",
  "judgeBlock": 3,
  "scheduleId": "P01-R2-control",
  "runId": "P01-R2-control-A1",
  "sourceArtifactBundleSha256": "08c2633c43efbf572fc961a9a8ce6e81c7a23b76e71d2a4bd400b20a71fca226",
  "blindBundlePath": "blind/B0003.bundle.json",
  "blindBundleSha256": "724f65ed2c9ddc7e8caaeb842a0075cfaf804920852e4dc5b9ef47bee0720414"
}
