{
  "protocolId": "ascii-art-powershell-cli-v1",
  "blindId": "B0059",
  "judgeBlock": 5,
  "scheduleId": "P10-R1-treatment",
  "runId": "P10-R1-treatment-A2",
  "sourceArtifactBundleSha256": "3ba2bf86bd0ddc9ca97ace4a62307d0142d54ceb871bdc980293731e13687a85",
  "blindBundlePath": "blind/B0059.bundle.json",
  "blindBundleSha256": "b611f9ec0504a70e64f61a78fd992ba255df2ba812d8ed45e183bc30505abfa4"
}
