{
  "protocolId": "ascii-art-powershell-cli-v1",
  "blindId": "B0061",
  "judgeBlock": 2,
  "scheduleId": "P05-R1-control",
  "runId": "P05-R1-control-A1",
  "sourceArtifactBundleSha256": "8569e06ca32a8338f63502b680713fa11a8b3d074aa3d1df98ef856becfd8905",
  "blindBundlePath": "blind/B0061.bundle.json",
  "blindBundleSha256": "003ee42786750a4b9820e9434b6c5bcb3de963e05af40ad35d2671c7aa96797f"
}
