{
  "protocolId": "ascii-art-powershell-cli-v1",
  "blindId": "B0010",
  "judgeBlock": 4,
  "scheduleId": "P02-R2-control",
  "runId": "P02-R2-control-A1",
  "sourceArtifactBundleSha256": "5e507f5cc44bad548a81cb94327475a9182d21693ec4a5359ecc2c334dffdd59",
  "blindBundlePath": "blind/B0010.bundle.json",
  "blindBundleSha256": "2c3a1e13897d1a7512b973ebc57b8e06d8ed92ff74b104d08477781431632e14"
}
