{
  "protocolId": "ascii-art-powershell-cli-v1",
  "blindId": "B0004",
  "judgeBlock": 4,
  "scheduleId": "P01-R1-treatment",
  "runId": "P01-R1-treatment-A1",
  "sourceArtifactBundleSha256": "8fc846d0bfa07c369a032a764e573b648a6f30de109b3ba19dcb2b49c3096688",
  "blindBundlePath": "blind/B0004.bundle.json",
  "blindBundleSha256": "8042b0ed4a12d502cb189b6af86bb316b3362a5000a9690b7d5c2e47a1454b35"
}
