{
  "protocolId": "ascii-art-powershell-cli-v1",
  "blindId": "B0007",
  "judgeBlock": 1,
  "scheduleId": "P02-R2-treatment",
  "runId": "P02-R2-treatment-A1",
  "sourceArtifactBundleSha256": "5c151a9e5922ed73cfa19e36bbc1ea1499a6e4d9fa82fd910fc7c095972da17a",
  "blindBundlePath": "blind/B0007.bundle.json",
  "blindBundleSha256": "b3c77ac0f1e072fe217d1912afcb57fed6d013bb3abc364d1469de531e5fc4df"
}
